{
  "$schema": "http://json-schema.org/draft-07/schema#",
  "$id": "https://github.com/krishddd/Strive_Engineering/schemas/loop.schema.json",
  "title": "Loop specification",
  "description": "A loop the loopengine runtime can execute. A valid loop has a trigger (cadence), a verifier, external state, and brakes/escalation.",
  "type": "object",
  "required": ["id", "kind", "phase", "target", "budget"],
  "additionalProperties": false,
  "properties": {
    "id": { "type": "string", "description": "Unique loop id; keys its state section." },
    "kind": {
      "type": "string",
      "enum": ["git-commit-triage", "pr-triage", "assisted-fix"],
      "description": "Loop type. git-commit-triage: read-only commit triage (L1). pr-triage: read-only open-PR triage over the guarded GitHub connector (L1). assisted-fix: propose a verified change on a branch in an isolated worktree (L2, no auto-merge)."
    },
    "task": {
      "type": "string",
      "description": "assisted-fix only: the change to make, in plain language."
    },
    "test_command": {
      "type": "string",
      "description": "assisted-fix only: ground-truth verifier run in the worktree (exit 0 = pass)."
    },
    "maker_command": {
      "type": "string",
      "description": "assisted-fix only: shell command run in the worktree to produce the change (the agent-step placeholder). Omitted when a maker callable is supplied programmatically."
    },
    "maker": {
      "type": "object",
      "description": "assisted-fix only: an agent maker that proposes file edits. 'llm' = Claude; 'nvidia' = NVIDIA NIM free tier; 'openai' = any OpenAI-compatible endpoint.",
      "required": ["type"],
      "additionalProperties": true,
      "properties": {
        "type": { "type": "string", "enum": ["llm", "nvidia", "openai"] },
        "model": { "type": "string", "description": "Model id. llm: claude-opus-4-8; nvidia: e.g. meta/llama-3.3-70b-instruct or qwen/qwen3-coder-480b-a35b-instruct." },
        "base_url": { "type": "string", "description": "openai only: the /v1 base URL of the OpenAI-compatible endpoint." },
        "api_key_env": { "type": "string", "description": "Env var holding the API key (nvidia: NVIDIA_API_KEY; openai: OPENAI_API_KEY)." }
      }
    },
    "allowlist": {
      "type": "object",
      "description": "L3 only: auto-merge gate. A verified change auto-merges into base_ref only if every file matches an allow glob, none match a deny glob, and it's within the size caps. Else it escalates (becomes a propose-only L2 result).",
      "required": ["allow_globs", "max_files", "max_lines"],
      "additionalProperties": false,
      "properties": {
        "allow_globs": { "type": "array", "items": { "type": "string" }, "minItems": 1 },
        "deny_globs": { "type": "array", "items": { "type": "string" } },
        "max_files": { "type": "integer", "minimum": 1 },
        "max_lines": { "type": "integer", "minimum": 1 }
      }
    },
    "proposer": {
      "type": "object",
      "description": "assisted-fix L2/L3 only: deliver a 'proposed' result as a GitHub PR. The one sanctioned L2 write (docs/safety.md): push the loop/* branch (explicit refspec, never force) and open a PR whose body carries the verifier evidence. Fires only on a 'proposed' result.",
      "required": ["type"],
      "additionalProperties": false,
      "properties": {
        "type": { "type": "string", "enum": ["github"] },
        "remote": { "type": "string", "default": "origin", "description": "Git remote to push the proposal branch to." },
        "repo_slug": { "type": "string", "description": "owner/name override; default parses it from the remote URL." },
        "token_env": { "type": "string", "default": "GITHUB_TOKEN", "description": "Env var holding the token (GH_TOKEN also honored)." }
      }
    },
    "connectors": {
      "type": "array",
      "description": "Read-only MCP connectors. Every tool return is injection-scanned before the loop acts. Write scope is L3-only.",
      "items": {
        "type": "object",
        "required": ["name"],
        "additionalProperties": false,
        "properties": {
          "name": { "type": "string" },
          "scope": { "type": "string", "enum": ["read", "write"], "default": "read" },
          "write_tools": { "type": "array", "items": { "type": "string" } }
        }
      }
    },
    "phase": {
      "type": "string",
      "enum": ["L0", "L1", "L2", "L3"],
      "description": "Rollout phase. L1 = report-only."
    },
    "cadence": {
      "type": "string",
      "description": "Human-readable trigger cadence (e.g. '1d'). Enforced by the scheduler, not the runtime."
    },
    "paused": { "type": "boolean", "default": false, "description": "Kill switch." },
    "state_file": { "type": "string", "description": "Path to the JSON state file." },
    "target": {
      "type": "object",
      "additionalProperties": false,
      "properties": {
        "repo": { "type": "string", "description": "Absolute path to the target git repo." },
        "slug": { "type": "string", "description": "pr-triage: GitHub 'owner/name' whose open PRs are triaged (read-only, via the guarded connector)." },
        "refs": {
          "type": "array",
          "items": { "type": "string" },
          "description": "git-commit-triage: branches/refs to watch. If 2+, ahead/behind divergence is reported."
        },
        "first_run_since": {
          "type": "string",
          "default": "7 days ago",
          "description": "Lookback window for the first triage run (no cursor yet)."
        },
        "base_ref": {
          "type": "string",
          "default": "main",
          "description": "assisted-fix: ref to branch the worktree off."
        }
      }
    },
    "budget": {
      "type": "object",
      "additionalProperties": false,
      "description": "Hard brakes (enforced by the Rust core, mirrored in Python).",
      "properties": {
        "max_tokens": { "type": "integer", "minimum": 0 },
        "max_iterations": { "type": "integer", "minimum": 1, "default": 1 },
        "wall_clock_secs": { "type": "integer", "minimum": 1 }
      }
    }
  },
  "allOf": [
    {
      "if": { "properties": { "kind": { "const": "git-commit-triage" } } },
      "then": { "properties": { "target": { "required": ["repo", "refs"] } } }
    },
    {
      "if": { "properties": { "kind": { "const": "pr-triage" } } },
      "then": { "properties": { "target": { "required": ["slug"] } } }
    },
    {
      "if": { "properties": { "kind": { "const": "assisted-fix" } } },
      "then": {
        "required": ["task", "test_command"],
        "properties": { "target": { "required": ["repo"] } }
      }
    }
  ]
}
