{
  "id": "ci-self-triage",
  "kind": "git-commit-triage",
  "phase": "L1",
  "cadence": "1d",
  "paused": false,
  "state_file": ".loop-state/state.json",
  "target": {
    "repo": ".",
    "refs": ["main"],
    "first_run_since": "14 days ago"
  },
  "budget": { "max_tokens": 50000, "max_iterations": 1, "wall_clock_secs": 300 }
}
