{
  "id": "example-assisted-fix",
  "kind": "assisted-fix",
  "phase": "L2",
  "state_file": ".loop-state/state.json",
  "target": {
    "repo": "/absolute/path/to/your/target/repo",
    "base_ref": "main"
  },
  "task": "Fix the failing unit test in the parser module.",
  "test_command": "python -m pytest -q",
  "maker": {
    "type": "nvidia",
    "model": "meta/llama-3.3-70b-instruct"
  },
  "proposer": {
    "type": "github",
    "remote": "origin",
    "token_env": "GITHUB_TOKEN"
  },
  "budget": {
    "max_tokens": 200000,
    "max_iterations": 3,
    "wall_clock_secs": 600
  }
}
